{
  "metadata": {
    "sourceFile": "Firebolt 9 API Specifications.pdf",
    "sourceFileSize": 1436953,
    "sourceSha256": "4bf5823afb68e00b457d65ccde53c86a45234731e3bbf6c4f16db23cc26e44a5",
    "sourceModified": "2026-10-21T20:12:58Z",
    "pdfVersion": "1.5",
    "generatedAt": "2026-10-22T00:02:08Z",
    "generator": {
      "script": "pdftojson.py"
    },
    "apiCount": 96,
    "pageCount": 11,
    "pdfInfo": {},
    "document": {
      "title": "Firebolt 9 Core API Specification",
      "specVersion": "9",
      "status": "DRAFT",
      "author": "Andrew Bennett",
      "note": "this is a draft of the latest Firebolt spec"
    },
    "approvedCount": 91,
    "unapprovedCount": 5
  },
  "interpretation": [
    {
      "term": "enum",
      "meaning": "an instance of a type that can have one of a pre-defined set of values. Typically represented by a string in JSON-RPC, but an integer in C++"
    },
    {
      "term": "list of",
      "meaning": "an ordered collection of values"
    },
    {
      "term": "list of... unordered",
      "meaning": "an unordered collection of values"
    },
    {
      "term": "one of",
      "meaning": "an instance of a primitive type, such as unsigned or string, that can have one of a pre-defined set of values. Not an enum"
    },
    {
      "term": "monotonic",
      "meaning": "a numeric value that is greater than the last instance of that attribute"
    },
    {
      "term": "generic error",
      "meaning": "an error that can be returned by any method call, documented in the Errors section"
    },
    {
      "term": "specific error",
      "meaning": "an error that can be returned by specific methods, documented along with the method"
    }
  ],
  "types": [
    {
      "name": "unsigned",
      "definition": "32-bit unsigned integer"
    },
    {
      "name": "double",
      "definition": "64-bit double-precision floating point number"
    }
  ],
  "genericErrors": [
    {
      "code": "-32601",
      "name": "Method not known",
      "description": "The method is not known to the version of Firebolt on this device"
    },
    {
      "code": "-40300",
      "name": "Method not permitted",
      "description": "The app does not have permission to call this method"
    },
    {
      "code": "-32602",
      "name": "Arguments invalid",
      "description": "The set of arguments is not valid"
    },
    {
      "code": "-32100",
      "name": "Unspecified error",
      "description": "Any unexpected error"
    }
  ],
  "specificErrors": [
    {
      "code": "-50100",
      "name": "Method not supported",
      "description": "A non-mandatory method that is not implemented on this device",
      "examples": "SecureStorage.get on a non-Comcast device"
    },
    {
      "code": "-xxxxx",
      "name": "App state invalid",
      "description": "The app is not in an appropriate lifecycle state to call this method",
      "openIssues": "Sathish to assign the error value"
    },
    {
      "code": "-xxxxx",
      "name": "Speech synthesis engine error",
      "description": "No speech synthesis engine is available or the engine rejected the request",
      "openIssues": "Sathish to assign the error value"
    },
    {
      "code": "-xxxxx",
      "name": "Wrong device class",
      "description": "The method is not appropriate for this class of device",
      "examples": "App is incorrectly calling VideoOutput.cecState on a TV device",
      "openIssues": "Sathish to assign the error value"
    }
  ],
  "apis": [
    {
      "module": "Accessibility",
      "method": "audioDescription",
      "events": [
        {
          "name": "onAudioDescriptionChanged"
        }
      ],
      "description": {
        "summary": "Returns the audio description setting of the device",
        "details": []
      },
      "apiVersion": "8.0.0",
      "deprecatedVersion": null,
      "approved": true,
      "support": {
        "cpp17": true,
        "javascript": true
      },
      "parameters": [],
      "returns": {
        "type": "bool"
      },
      "specificErrors": []
    },
    {
      "module": "Accessibility",
      "method": "closedCaptionsSettings",
      "events": [
        {
          "name": "onClosedCaptionsSettingsChanged"
        }
      ],
      "description": {
        "summary": "Returns captions settings: enabled, and a list of zero or more languages in order of decreasing preference",
        "details": []
      },
      "apiVersion": "8.0.0",
      "deprecatedVersion": null,
      "approved": true,
      "support": {
        "cpp17": true,
        "javascript": true
      },
      "parameters": [],
      "returns": {
        "type": "object",
        "properties": [
          {
            "name": "enabled",
            "type": "bool"
          },
          {
            "name": "preferredLanguages",
            "type": "array",
            "ordered": true,
            "items": {
              "type": "string"
            },
            "description": "[] (if not initialized); list of one or more ISO 639-2/B"
          }
        ]
      },
      "specificErrors": []
    },
    {
      "module": "Accessibility",
      "method": "highContrastUI",
      "events": [
        {
          "name": "onHighContrastUIChanged"
        }
      ],
      "description": {
        "summary": "Returns the high contrast UI device setting",
        "details": []
      },
      "apiVersion": "8.0.0",
      "deprecatedVersion": null,
      "approved": true,
      "support": {
        "cpp17": true,
        "javascript": true
      },
      "parameters": [],
      "returns": {
        "type": "bool"
      },
      "specificErrors": []
    },
    {
      "module": "Accessibility",
      "method": "voiceGuidanceSettings",
      "events": [
        {
          "name": "onVoiceGuidanceSettingsChanged"
        }
      ],
      "description": {
        "summary": "Returns voice guidance settings: enabled, rate, and verbosity",
        "details": []
      },
      "apiVersion": "8.0.0",
      "deprecatedVersion": null,
      "approved": true,
      "support": {
        "cpp17": true,
        "javascript": true
      },
      "parameters": [],
      "returns": {
        "type": "object",
        "properties": [
          {
            "name": "enabled",
            "type": "bool"
          },
          {
            "name": "rate",
            "type": "double",
            "description": "1 (normal rate); 0.1 to 10 inclusive"
          },
          {
            "name": "navigationHints",
            "type": "bool"
          }
        ]
      },
      "specificErrors": []
    },
    {
      "module": "Actions",
      "method": "start",
      "events": [],
      "description": {
        "summary": "Send an intent to the platform",
        "details": [
          "Argument is a JSON document"
        ]
      },
      "apiVersion": "9.0.0",
      "deprecatedVersion": null,
      "approved": true,
      "support": {
        "cpp17": true,
        "javascript": true
      },
      "parameters": [
        {
          "name": "intent",
          "type": "json",
          "required": true
        },
        {
          "name": "handlerAppId",
          "type": "string",
          "required": false
        }
      ],
      "returns": {
        "type": "null"
      },
      "specificErrors": []
    },
    {
      "module": "Actions",
      "method": "intent",
      "events": [
        {
          "name": "onIntent"
        }
      ],
      "description": {
        "summary": "Returns the intent that was most recently received from the platform, as a JSON document. Getter is typically called by an app after transitioning to the active lifecycle state",
        "details": []
      },
      "apiVersion": "9.0.0",
      "deprecatedVersion": null,
      "approved": true,
      "support": {
        "cpp17": true,
        "javascript": true
      },
      "parameters": [],
      "returns": {
        "type": "object",
        "properties": [
          {
            "name": "intentId",
            "type": "unsigned",
            "monotonic": true
          },
          {
            "name": "intent",
            "type": "json"
          }
        ]
      },
      "specificErrors": []
    },
    {
      "module": "Advertising",
      "method": "advertisingId",
      "events": [],
      "description": {
        "summary": "Returns the IFA",
        "details": []
      },
      "apiVersion": "8.0.0",
      "deprecatedVersion": null,
      "approved": true,
      "support": {
        "cpp17": true,
        "javascript": true
      },
      "parameters": [],
      "returns": {
        "type": "object",
        "properties": [
          {
            "name": "ifa",
            "type": "string",
            "description": "a UUID"
          },
          {
            "name": "ifa_type",
            "type": "string",
            "oneOf": [
              "dpid",
              "sspid",
              "sessionid"
            ],
            "enumDescriptions": {
              "dpid": "device provided ID",
              "sspid": "SSP provided ID",
              "sessionid": "session/synthetic ID"
            }
          },
          {
            "name": "lmt",
            "type": "string",
            "oneOf": [
              "0",
              "1"
            ]
          }
        ]
      },
      "specificErrors": []
    },
    {
      "module": "Audio",
      "method": "volume",
      "events": [
        {
          "name": "onVolumeChanged"
        }
      ],
      "description": {
        "summary": "Returns the current volume level of the device or HDMI-connected audio output device. Range is 0 to 100 inclusive",
        "details": [
          "OTT/STB device: returns Wrong device class error"
        ]
      },
      "apiVersion": "9.0.0",
      "deprecatedVersion": null,
      "approved": true,
      "support": {
        "cpp17": true,
        "javascript": false
      },
      "parameters": [],